{
  "spec_version": "1.0.0",
  "game_id": "G01",
  "working_title": "信号港 / Signal Harbor",
  "status": "SPEC_DRAFTED",
  "ready_for_build": false,
  "independent_review": "PENDING",
  "human_build_approval": false,
  "preparation_date": "2026-10-21",
  "all_design_values": "HYPOTHESIS",
  "candidate_platform_ids": [
    "P02",
    "P04",
    "P05"
  ],
  "audience": "16+ logic-puzzle players; not child-directed",
  "engine": {
    "name": "Cocos Creator",
    "candidate_version": "3.8.8",
    "language": "TypeScript",
    "version_source": "https://www.cocos.com/en/creator-download",
    "checked_date": "2026-10-21",
    "installation": "NOT_VERIFIED; executable not found on PATH",
    "build_tested": false
  },
  "rules": {
    "coordinates": "integer x right, y down; origin top-left; 0<=x<width,0<=y<height",
    "arrow_shape": "ordered distinct orthogonally adjacent cells, tail to head; last segment equals direction; singleton allowed",
    "movement": "rigid translation of ALL occupied cells by heading vector; no snake-following, rotation or partial movement",
    "collision": "union of in-bounds translated cells for k=1..max(width,height), against other remaining arrows, walls and CLOSED gates; own initial cells ignored",
    "exit_edge": "direction alone determines edge; any coordinate on that edge is valid",
    "legal_order": [
      "UNKNOWN_OR_REMOVED",
      "MANIFEST_MISMATCH",
      "ARROW_COLLISION",
      "WALL_COLLISION",
      "CLOSED_GATE"
    ],
    "commit_order": [
      "validate complete sweep in pre-state",
      "remove arrow",
      "XOR each listed gate once",
      "advance manifest cursor if nonempty",
      "evaluate win then deadlock",
      "persist logical state",
      "animate"
    ],
    "gate_semantics": "initial_open XOR removed-arrow toggles; gates never rotate or move; open gates are passable and never occupy an initial arrow cell",
    "manifest_semantics": "empty disables; otherwise one direction per arrow; next direction must match; no skip and no wildcard",
    "invalid_action": "state unchanged; no hearts, time limit, currency or loss of attempt",
    "deadlock": "remaining>0 AND no legal EXIT; undo/reset enabled; no ad rescue",
    "win": "all arrows removed AND manifest cursor == manifest length",
    "undo": "pop last accepted EXIT; recompute gates and manifest from original data and remaining log; no redo",
    "hint": "lexicographically first arrow whose successor can reach win; no legal winning successor => show undo/reset",
    "rng": "none in play; level seed is provenance only",
    "canonical_state_key": "removed bitmask; gates and cursor derived"
  },
  "variants": [
    {
      "id": "BASE",
      "relay": false,
      "manifest": false
    },
    {
      "id": "RELAY",
      "relay": true,
      "manifest": false
    },
    {
      "id": "MANIFEST",
      "relay": false,
      "manifest": true
    },
    {
      "id": "COMBINED",
      "relay": true,
      "manifest": true
    }
  ],
  "progression": {
    "order": [
      "L01",
      "L02",
      "L03",
      "L04",
      "L05",
      "L06",
      "L07",
      "L08",
      "L09",
      "L10",
      "L11",
      "L12",
      "L13",
      "L14",
      "L15",
      "L16",
      "L17",
      "L18",
      "L19",
      "L20"
    ],
    "unlock": "L01 open; L(n+1) after first completion Ln; all completed replayable",
    "rewards": "one first-clear stamp per level, replay gives none; stamp count derived from completed-level set",
    "hint_cost": 0,
    "undo_cost": 0,
    "retry_cost": 0,
    "ads": "disabled in initial product; Full/P04 adapter ad capability reserved but not activated",
    "end": "after L20 show all 20 stamps and replay/map buttons; no endless or daily mode"
  },
  "ui": {
    "screens": [
      "BOOT",
      "HOME",
      "MAP",
      "PLAY",
      "PAUSE",
      "HELP",
      "DEADLOCK",
      "WIN",
      "COMPLETE",
      "SETTINGS",
      "CREDITS",
      "RECOVERY",
      "ERROR"
    ],
    "portrait_reference": [
      390,
      844
    ],
    "landscape_reference": [
      844,
      390
    ],
    "min_viewport": [
      320,
      360
    ],
    "touch_min_css_px": 44,
    "pointer_commit": "pointerup on same arrow after <=10 CSS px movement, pointercancel cancels; no hold timer",
    "keyboard": "Tab focus by arrow ID then controls; Enter/Space activate; U undo; H hint; R opens reset confirmation; Escape pause/back",
    "palette": {
      "background": "#101F2B",
      "surface": "#193546",
      "arrow": "#F4EBD0",
      "signal_g": "#F0B75E",
      "signal_h": "#62C9CB",
      "error": "#F27578"
    },
    "reduced_motion": true,
    "default_music": false,
    "default_sound": true,
    "languages": [
      "en",
      "zh-CN"
    ]
  },
  "save": {
    "version": 1,
    "key": "G01.signalharbor.{profile}.v1",
    "fields": [
      "version",
      "content_version",
      "revision",
      "completed",
      "active_level",
      "accepted_exits",
      "tutorial_seen",
      "settings"
    ],
    "authoritative": "accepted_exits replay; never trust stored gates/cursor",
    "commit": "temp JSON -> validate -> backup old -> main; recover newest valid revision; local commit after every EXIT/UNDO/RESET/WIN/settings",
    "migration": "v0 absent starts new; v1 strict validation; unknown newer version read-only recovery, never overwrite automatically",
    "cloud": "same channel only; union completed and choose newest valid active revision; equal revision conflict prompts user; no device fingerprint",
    "private_mode": "memory-only with visible notice; no blocking gameplay"
  },
  "channel_profiles": [
    {
      "id": "LOCAL_QA",
      "sdk": "none",
      "analytics": "local opt-in bounded replay, no upload",
      "ads": false,
      "total_mb_cap": 15,
      "file_cap": 250
    },
    {
      "id": "P02_BASIC",
      "sdk": "none",
      "analytics": "platform-native outside bundle; no third-party SDK",
      "ads": false,
      "total_mb_cap": 20,
      "file_cap": 250
    },
    {
      "id": "P02_FULL",
      "sdk": "CrazyGames required",
      "analytics": "CrazyGames SDK only",
      "ads": false,
      "total_mb_cap": 250,
      "file_cap": 1500
    },
    {
      "id": "P04",
      "sdk": "Playgama Bridge required",
      "analytics": "Bridge only; no GA4 or equivalent",
      "ads": false,
      "total_mb_cap": 300,
      "file_cap": 250
    },
    {
      "id": "P05",
      "sdk": "UNKNOWN pending written mobile compatibility",
      "analytics": "none until publisher-specific isolated contract approval",
      "ads": false,
      "total_mb_cap": 100,
      "file_cap": 250
    },
    {
      "id": "P01_RESERVED",
      "sdk": "none",
      "analytics": "none; no developer callback",
      "ads": false,
      "total_mb_cap": 15,
      "file_cap": 250
    }
  ],
  "performance_hypotheses": {
    "total_web_mb": 15,
    "initial_web_mb": 8,
    "frame_p95_ms": 20.0,
    "input_feedback_p95_ms": 100,
    "local_solver_max_states": 256,
    "local_solver_budget_ms": 50,
    "measured": false
  },
  "levels": [
    {
      "id": "L01",
      "name": "开港",
      "evidence_status": "HYPOTHESIS",
      "mode": "BASE",
      "width": 4,
      "height": 4,
      "arrows": [
        {
          "id": "a",
          "direction": "E",
          "cells": [
            [
              1,
              1
            ],
            [
              2,
              1
            ]
          ],
          "toggles": []
        },
        {
          "id": "b",
          "direction": "N",
          "cells": [
            [
              1,
              3
            ],
            [
              1,
              2
            ]
          ],
          "toggles": []
        }
      ],
      "gates": [],
      "walls": [],
      "manifest": [],
      "initial_state": {
        "removed": [],
        "manifest_cursor": 0
      },
      "win": {
        "all_arrows_removed": true,
        "manifest_consumed": true
      },
      "solution": [
        {
          "type": "EXIT",
          "arrow_id": "a"
        },
        {
          "type": "EXIT",
          "arrow_id": "b"
        }
      ],
      "learning_objective": "点击整条箭头，清空棋盘",
      "seed": 10101,
      "target_seconds": [
        13,
        31
      ]
    },
    {
      "id": "L02",
      "name": "先疏后发",
      "evidence_status": "HYPOTHESIS",
      "mode": "BASE",
      "width": 5,
      "height": 4,
      "arrows": [
        {
          "id": "a",
          "direction": "E",
          "cells": [
            [
              0,
              1
            ],
            [
              1,
              1
            ]
          ],
          "toggles": []
        },
        {
          "id": "b",
          "direction": "N",
          "cells": [
            [
              3,
              2
            ],
            [
              3,
              1
            ]
          ],
          "toggles": []
        },
        {
          "id": "c",
          "direction": "W",
          "cells": [
            [
              2,
              3
            ],
            [
              1,
              3
            ]
          ],
          "toggles": []
        }
      ],
      "gates": [],
      "walls": [],
      "manifest": [],
      "initial_state": {
        "removed": [],
        "manifest_cursor": 0
      },
      "win": {
        "all_arrows_removed": true,
        "manifest_consumed": true
      },
      "solution": [
        {
          "type": "EXIT",
          "arrow_id": "b"
        },
        {
          "type": "EXIT",
          "arrow_id": "a"